{
  "authors": [
    {
      "author_identity_verified": true,
      "google_scholar": {
        "h_index": null,
        "h_index_scope": null,
        "h_index_status": "unavailable",
        "missing_reason": "No Google Scholar profile was checked in this bounded work snapshot; unknown does not mean zero.",
        "profile_attempt": null,
        "profile_batch_id": null,
        "profile_identity_evidence": null,
        "profile_identity_verified": false,
        "profile_link_evidence": null,
        "profile_url": null,
        "retrieved_utc": null,
        "status": "unqueried"
      },
      "identity_evidence": "Author name and linked INSPIRE author record occur in the exact base-arXiv-ID provider record.",
      "paper_author_name": "Vivian Poulin",
      "source_author_id": "1341720"
    },
    {
      "author_identity_verified": true,
      "google_scholar": {
        "h_index": null,
        "h_index_scope": null,
        "h_index_status": "unavailable",
        "missing_reason": "No Google Scholar profile was checked in this bounded work snapshot; unknown does not mean zero.",
        "profile_attempt": null,
        "profile_batch_id": null,
        "profile_identity_evidence": null,
        "profile_identity_verified": false,
        "profile_link_evidence": null,
        "profile_url": null,
        "retrieved_utc": null,
        "status": "unqueried"
      },
      "identity_evidence": "Author name and linked INSPIRE author record occur in the exact base-arXiv-ID provider record.",
      "paper_author_name": "Tristan L. Smith",
      "source_author_id": "1024718"
    },
    {
      "author_identity_verified": true,
      "google_scholar": {
        "h_index": null,
        "h_index_scope": null,
        "h_index_status": "unavailable",
        "missing_reason": "No Google Scholar profile was checked in this bounded work snapshot; unknown does not mean zero.",
        "profile_attempt": null,
        "profile_batch_id": null,
        "profile_identity_evidence": null,
        "profile_identity_verified": false,
        "profile_link_evidence": null,
        "profile_url": null,
        "retrieved_utc": null,
        "status": "unqueried"
      },
      "identity_evidence": "Author name and linked INSPIRE author record occur in the exact base-arXiv-ID provider record.",
      "paper_author_name": "Tanvi Karwal",
      "source_author_id": "1597061"
    },
    {
      "author_identity_verified": true,
      "google_scholar": {
        "h_index": null,
        "h_index_scope": null,
        "h_index_status": "unavailable",
        "missing_reason": "No Google Scholar profile was checked in this bounded work snapshot; unknown does not mean zero.",
        "profile_attempt": null,
        "profile_batch_id": null,
        "profile_identity_evidence": null,
        "profile_identity_verified": false,
        "profile_link_evidence": null,
        "profile_url": null,
        "retrieved_utc": null,
        "status": "unqueried"
      },
      "identity_evidence": "Author name and linked INSPIRE author record occur in the exact base-arXiv-ID provider record.",
      "paper_author_name": "Marc Kamionkowski",
      "source_author_id": "1003810"
    }
  ],
  "citation_snapshot": {
    "count": 1170,
    "count_without_self_citations": 1114,
    "missing_reason": null,
    "retrieved_utc": "2026-10-01T16:43:37.396684+00:00",
    "source": {
      "archive_path": ".work/2026-10-01-crawl/bibliometrics/inspire-1811.04083.json",
      "http_status": 200,
      "provider": "INSPIRE-HEP REST API",
      "request_url": "https://inspirehep.net/api/literature?q=arxiv%3A1811.04083&size=10&fields=arxiv_eprints%2Ctitles%2Cauthors.full_name%2Cauthors.record%2Ccitation_count%2Ccitation_count_without_self_citations%2Cearliest_date%2Cdois%2Cpublication_info",
      "response_bytes": 2797,
      "response_sha256": "9335d80aec72e4213a0d98241a400d86f9239c70d8b1a08054557152cf6b1f6e",
      "retrieved_utc": "2026-10-01T16:43:37.396684+00:00"
    },
    "status": "observed"
  },
  "comparison": {
    "age_days_at_snapshot": 2882.9052939431017,
    "age_years_at_snapshot": 7.893126604771081,
    "cohort": {
      "age_band_years": {
        "lower_inclusive": 7.0,
        "upper_exclusive": 8.0
      },
      "field_definition": "arXiv primary category: astro-ph.CO",
      "minimum_population_size": 100,
      "percentile": null,
      "population_evidence": null,
      "population_size": null,
      "provider": "INSPIRE-HEP",
      "reason": "No provider population was queried for this provider, snapshot batch, arXiv primary category, and publication-age band. The deliberately selected Prospector sample is not a percentile reference population.",
      "snapshot_batch_id": "inspire-2026-10-01-bounded-five-work-snapshot",
      "status": "not_queried"
    },
    "field_categories": [
      "astro-ph.CO",
      "hep-ph"
    ],
    "first_publication_utc": "2018-11-09T19:00:00Z"
  },
  "paper_id": "arxiv:1811.04083v2",
  "schema_version": 1,
  "snapshot_created_utc": "2026-10-01T17:16:18.789596+00:00",
  "snapshot_id": "20261001T171618789596Z-4952d35972b0",
  "team_visibility": {
    "coverage_fraction": 0.0,
    "h_index_scope": null,
    "h_index_snapshot_batch_id": null,
    "max_h_index": null,
    "median_h_index": null,
    "missing_reason": "Team maximum and median use verified, observed, same-scope h-indices only; missing author metrics are unknown.",
    "status": "none",
    "unique_author_count": 4,
    "verified_h_index_author_count": 0
  },
  "work_identity": {
    "arxiv_id": "1811.04083",
    "count_scope": "provider_base_work_record",
    "journal_metadata": [
      {
        "article_or_page": "221301",
        "journal_title": "Phys.Rev.Lett.",
        "volume": "122",
        "year": 2019
      }
    ],
    "journal_scope": "linked_journal_metadata_returned",
    "linked_dois": [
      "10.1103/PhysRevLett.122.221301"
    ],
    "match_status": "exact",
    "matched_arxiv_ids": [
      "1811.04083"
    ],
    "provider": "INSPIRE-HEP",
    "provider_record_id": "1703158",
    "publication_scope_note": "Citation counts are totals for this provider literature record. They are not split between the registered arXiv version, other arXiv versions, and linked journal publication records.",
    "registered_version": 2,
    "source": {
      "archive_path": ".work/2026-10-01-crawl/bibliometrics/inspire-1811.04083.json",
      "http_status": 200,
      "provider": "INSPIRE-HEP REST API",
      "request_url": "https://inspirehep.net/api/literature?q=arxiv%3A1811.04083&size=10&fields=arxiv_eprints%2Ctitles%2Cauthors.full_name%2Cauthors.record%2Ccitation_count%2Ccitation_count_without_self_citations%2Cearliest_date%2Cdois%2Cpublication_info",
      "response_bytes": 2797,
      "response_sha256": "9335d80aec72e4213a0d98241a400d86f9239c70d8b1a08054557152cf6b1f6e",
      "retrieved_utc": "2026-10-01T16:43:37.396684+00:00"
    },
    "title": "Early Dark Energy Can Resolve The Hubble Tension",
    "version_scope": "versions_not_disaggregated"
  }
}
