{
  "authors": [
    {
      "author_identity_verified": true,
      "google_scholar": {
        "h_index": null,
        "h_index_scope": null,
        "h_index_status": "unavailable",
        "missing_reason": "No Google Scholar profile was checked in this bounded work snapshot; unknown does not mean zero.",
        "profile_attempt": null,
        "profile_batch_id": null,
        "profile_identity_evidence": null,
        "profile_identity_verified": false,
        "profile_link_evidence": null,
        "profile_url": null,
        "retrieved_utc": null,
        "status": "unqueried"
      },
      "identity_evidence": "The normalized author name has one linked INSPIRE author record in the exact base-arXiv-ID provider record.",
      "paper_author_name": "Mathias Garny",
      "source_author_id": "1037237"
    },
    {
      "author_identity_verified": true,
      "google_scholar": {
        "h_index": null,
        "h_index_scope": null,
        "h_index_status": "unavailable",
        "missing_reason": "No Google Scholar profile was checked in this bounded work snapshot; unknown does not mean zero.",
        "profile_attempt": null,
        "profile_batch_id": null,
        "profile_identity_evidence": null,
        "profile_identity_verified": false,
        "profile_link_evidence": null,
        "profile_url": null,
        "retrieved_utc": null,
        "status": "unqueried"
      },
      "identity_evidence": "The normalized author name has one linked INSPIRE author record in the exact base-arXiv-ID provider record.",
      "paper_author_name": "Florian Niedermann",
      "source_author_id": "1259406"
    },
    {
      "author_identity_verified": true,
      "google_scholar": {
        "h_index": null,
        "h_index_scope": null,
        "h_index_status": "unavailable",
        "missing_reason": "No Google Scholar profile was checked in this bounded work snapshot; unknown does not mean zero.",
        "profile_attempt": null,
        "profile_batch_id": null,
        "profile_identity_evidence": null,
        "profile_identity_verified": false,
        "profile_link_evidence": null,
        "profile_url": null,
        "retrieved_utc": null,
        "status": "unqueried"
      },
      "identity_evidence": "The normalized author name has one linked INSPIRE author record in the exact base-arXiv-ID provider record.",
      "paper_author_name": "Martin S. Sloth",
      "source_author_id": "1032103"
    }
  ],
  "citation_snapshot": {
    "count": 8,
    "count_without_self_citations": 7,
    "missing_reason": null,
    "retrieved_utc": "2026-10-09T17:48:23.330948+00:00",
    "source": {
      "archive_path": ".work/bibliometrics/2026-10-09/inspire-2604.26541-fdd1a9e6c1ea.json",
      "http_status": 200,
      "provider": "INSPIRE-HEP REST API",
      "request_url": "https://inspirehep.net/api/literature?q=arxiv%3A2604.26541&size=10&fields=arxiv_eprints%2Ctitles%2Cauthors.full_name%2Cauthors.record%2Ccitation_count%2Ccitation_count_without_self_citations%2Cearliest_date%2Cdois%2Cpublication_info",
      "response_bytes": 2345,
      "response_sha256": "fdd1a9e6c1ea74f3d47fd3ce49e9db576fda96b0ee1654caedc900208c6cbc96",
      "retrieved_utc": "2026-10-09T17:48:23.330948+00:00"
    },
    "status": "observed"
  },
  "comparison": {
    "age_days_at_snapshot": 163.27464503412037,
    "age_years_at_snapshot": 0.4470307947024795,
    "cohort": {
      "age_band_years": {
        "lower_inclusive": 0.0,
        "upper_exclusive": 1.0
      },
      "field_definition": "arXiv primary category: astro-ph.CO",
      "minimum_population_size": 100,
      "percentile": null,
      "population_evidence": null,
      "population_size": null,
      "provider": "INSPIRE-HEP",
      "reason": "No provider population was queried for this provider, snapshot batch, arXiv primary category, and publication-age band. The deliberately selected Prospector sample is not a percentile reference population.",
      "snapshot_batch_id": "interacting-radiation-20261009",
      "status": "not_queried"
    },
    "field_categories": [
      "astro-ph.CO",
      "hep-ph",
      "hep-th"
    ],
    "first_publication_utc": "2026-04-29T11:12:54Z"
  },
  "paper_id": "arxiv:2604.26541v1",
  "schema_version": 1,
  "snapshot_created_utc": "2026-10-09T17:48:23.459684+00:00",
  "snapshot_id": "20261009T174823459684Z-db4dd543f715",
  "team_visibility": {
    "coverage_fraction": 0.0,
    "h_index_scope": null,
    "h_index_snapshot_batch_id": null,
    "max_h_index": null,
    "median_h_index": null,
    "missing_reason": "Team maximum and median use verified, observed, same-scope h-indices only; missing author metrics are unknown.",
    "status": "none",
    "unique_author_count": 3,
    "verified_h_index_author_count": 0
  },
  "work_identity": {
    "arxiv_id": "2604.26541",
    "count_scope": "provider_base_work_record",
    "journal_metadata": [],
    "journal_scope": "no_linked_journal_metadata_in_response",
    "linked_dois": [],
    "match_status": "exact",
    "matched_arxiv_ids": [
      "2604.26541"
    ],
    "provider": "INSPIRE-HEP",
    "provider_record_id": "3150194",
    "publication_scope_note": "Citation counts are totals for this provider literature record. They are not split between the registered arXiv version, other arXiv versions, and linked journal publication records.",
    "registered_version": 1,
    "source": {
      "archive_path": ".work/bibliometrics/2026-10-09/inspire-2604.26541-fdd1a9e6c1ea.json",
      "http_status": 200,
      "provider": "INSPIRE-HEP REST API",
      "request_url": "https://inspirehep.net/api/literature?q=arxiv%3A2604.26541&size=10&fields=arxiv_eprints%2Ctitles%2Cauthors.full_name%2Cauthors.record%2Ccitation_count%2Ccitation_count_without_self_citations%2Cearliest_date%2Cdois%2Cpublication_info",
      "response_bytes": 2345,
      "response_sha256": "fdd1a9e6c1ea74f3d47fd3ce49e9db576fda96b0ee1654caedc900208c6cbc96",
      "retrieved_utc": "2026-10-09T17:48:23.330948+00:00"
    },
    "title": "The End of the First Act: Spectral Running, Interacting Dark Radiation, and the Hubble Tension in Light of ACT DR6 Data",
    "version_scope": "versions_not_disaggregated"
  }
}
