{
  "schema_version": 1,
  "paper_id": "arxiv:2607.03272v1",
  "work_identity": {
    "arxiv_id": "2607.03272",
    "registered_version": 1,
    "title": "Dark energy genesis: modeling dissipative effects in primordial cosmology",
    "match_status": "exact",
    "provider": "INSPIRE-HEP",
    "provider_record_id": "3177499",
    "matched_arxiv_ids": [
      "2607.03272"
    ],
    "linked_dois": [
      "10.1103/gql7-743d"
    ],
    "journal_metadata": [
      {
        "journal_title": "Phys.Rev.D",
        "year": 2026,
        "volume": "114",
        "article_or_page": "046030"
      }
    ],
    "journal_scope": "linked_journal_metadata_returned",
    "count_scope": "provider_base_work_record",
    "version_scope": "versions_not_disaggregated",
    "publication_scope_note": "Citation counts are totals for this provider literature record. They are not split between the registered arXiv version, other arXiv versions, and linked journal publication records.",
    "source": {
      "provider": "INSPIRE-HEP REST API",
      "request_url": "https://inspirehep.net/api/literature?q=arxiv%3A2607.03272&size=10&fields=arxiv_eprints%2Ctitles%2Cauthors.full_name%2Cauthors.record%2Ccitation_count%2Ccitation_count_without_self_citations%2Cearliest_date%2Cdois%2Cpublication_info",
      "retrieved_utc": "2026-10-09T17:58:18.846963+00:00",
      "http_status": 200,
      "response_sha256": "86e259822758c2d9f81feacfd75302ab8e5f01abf914115405f4b9a2bc6514dc",
      "response_bytes": 2717,
      "archive_path": ".work/unconventional-20261009/bibliometrics/2026-10-09/inspire-2607.03272-86e259822758.json"
    }
  },
  "citation_snapshot": {
    "status": "observed",
    "count": 3,
    "count_without_self_citations": 3,
    "retrieved_utc": "2026-10-09T17:58:18.846963+00:00",
    "source": {
      "provider": "INSPIRE-HEP REST API",
      "request_url": "https://inspirehep.net/api/literature?q=arxiv%3A2607.03272&size=10&fields=arxiv_eprints%2Ctitles%2Cauthors.full_name%2Cauthors.record%2Ccitation_count%2Ccitation_count_without_self_citations%2Cearliest_date%2Cdois%2Cpublication_info",
      "retrieved_utc": "2026-10-09T17:58:18.846963+00:00",
      "http_status": 200,
      "response_sha256": "86e259822758c2d9f81feacfd75302ab8e5f01abf914115405f4b9a2bc6514dc",
      "response_bytes": 2717,
      "archive_path": ".work/unconventional-20261009/bibliometrics/2026-10-09/inspire-2607.03272-86e259822758.json"
    },
    "missing_reason": null
  },
  "comparison": {
    "first_publication_utc": "2026-07-03T12:40:38Z",
    "age_days_at_snapshot": 98.22061165466435,
    "age_years_at_snapshot": 0.2689189008800026,
    "field_categories": [
      "gr-qc",
      "astro-ph.CO",
      "cond-mat.other",
      "hep-th"
    ],
    "cohort": {
      "provider": "INSPIRE-HEP",
      "snapshot_batch_id": "everpresent-20261009",
      "field_definition": "arXiv primary category: gr-qc",
      "age_band_years": {
        "lower_inclusive": 0.0,
        "upper_exclusive": 1.0
      },
      "population_size": null,
      "minimum_population_size": 100,
      "population_evidence": null,
      "percentile": null,
      "status": "not_queried",
      "reason": "No provider population was queried for this provider, snapshot batch, arXiv primary category, and publication-age band. The deliberately selected Prospector sample is not a percentile reference population."
    }
  },
  "authors": [
    {
      "paper_author_name": "Pietro Pellecchia",
      "source_author_id": "2933753",
      "author_identity_verified": true,
      "identity_evidence": "The normalized author name has one linked INSPIRE author record in the exact base-arXiv-ID provider record.",
      "google_scholar": {
        "profile_url": null,
        "profile_link_evidence": null,
        "profile_identity_evidence": null,
        "profile_attempt": null,
        "status": "unqueried",
        "profile_identity_verified": false,
        "h_index_status": "unavailable",
        "h_index": null,
        "h_index_scope": null,
        "profile_batch_id": null,
        "retrieved_utc": null,
        "missing_reason": "No Google Scholar profile was checked in this bounded work snapshot; unknown does not mean zero."
      }
    },
    {
      "paper_author_name": "Alejandro Perez",
      "source_author_id": "993792",
      "author_identity_verified": true,
      "identity_evidence": "The normalized author name has one linked INSPIRE author record in the exact base-arXiv-ID provider record.",
      "google_scholar": {
        "profile_url": null,
        "profile_link_evidence": null,
        "profile_identity_evidence": null,
        "profile_attempt": null,
        "status": "unqueried",
        "profile_identity_verified": false,
        "h_index_status": "unavailable",
        "h_index": null,
        "h_index_scope": null,
        "profile_batch_id": null,
        "retrieved_utc": null,
        "missing_reason": "No Google Scholar profile was checked in this bounded work snapshot; unknown does not mean zero."
      }
    },
    {
      "paper_author_name": "Salvatore Ribisi",
      "source_author_id": "1844709",
      "author_identity_verified": true,
      "identity_evidence": "The normalized author name has one linked INSPIRE author record in the exact base-arXiv-ID provider record.",
      "google_scholar": {
        "profile_url": null,
        "profile_link_evidence": null,
        "profile_identity_evidence": null,
        "profile_attempt": null,
        "status": "unqueried",
        "profile_identity_verified": false,
        "h_index_status": "unavailable",
        "h_index": null,
        "h_index_scope": null,
        "profile_batch_id": null,
        "retrieved_utc": null,
        "missing_reason": "No Google Scholar profile was checked in this bounded work snapshot; unknown does not mean zero."
      }
    }
  ],
  "team_visibility": {
    "status": "none",
    "unique_author_count": 3,
    "verified_h_index_author_count": 0,
    "coverage_fraction": 0.0,
    "h_index_scope": null,
    "h_index_snapshot_batch_id": null,
    "max_h_index": null,
    "median_h_index": null,
    "missing_reason": "Team maximum and median use verified, observed, same-scope h-indices only; missing author metrics are unknown."
  },
  "snapshot_created_utc": "2026-10-09T17:58:18.973814+00:00",
  "snapshot_id": "20261009T175818973814Z-9605c59fd56f"
}
